{
  "id": "SRC-002",
  "title": "Real-world fractions media",
  "citation": "Smithsonian Open Access — objects and images in the public domain.",
  "uri": "https://www.si.edu/openaccess",
  "tier": "primary",
  "authorityType": "museum_library",
  "license": "public_domain",
  "reviewStatus": "approved",
  "reviewedAt": "2026-08-05",
  "reviewBy": "2027-08-05"
}
