{
  "id": "SRC-001",
  "title": "Fraction models and tasks (grade 3)",
  "citation": "Illustrative Mathematics, Grade 3 Unit — fractions as equal parts.",
  "uri": "https://www.illustrativemathematics.org/",
  "tier": "oer",
  "authorityType": "open_courseware",
  "license": "cc_by",
  "reviewStatus": "approved",
  "reviewedAt": "2026-08-01",
  "reviewBy": "2027-08-01"
}
